,Text,Level
0,"My first child was born just as I was about to be elected onto the Greater London Council, and the others followed in quite quick succession. My wife and I vowed that we would carve out time for them but since I have become more and more politically active, time has become a real problem. 
I make it a condition that I will only accept weekend meetings and public appearances where there are facilities for one or more of the kids to come with me. If I did not they would just get squeezed out. This way they have a sense of what I do when I am not with them and there is no feeling of Daddy disappearing.
I've noticed more and more MPs bringing their kids to the House. Maybe we are all becoming more conscious of the need to involve our children in our lives.",4
1,"Cartoon films have very few limits. If you can draw something, you can make it move on the cinema screen. The use of new ideas and advanced computer programs means that cartoons are becoming exciting again for people of all ages. 
By the end of the 1970s, the cinema world had decided that cartoons were only for children. 
But soon afterwards, one or two directors had some original new ideas. They proved that it was possible to make films in which both adults and children could share the fun. 
However, not every cartoon film was successful. The Black Cauldron, for example, failed, mainly because it was too frightening for children and too childish for adults. Directors learnt from this mistake, and the film companies began to make large amounts of money again. 
",2
2,"Nick Barlow loves his work. He's a British actor and he travels around the world making TV programmes. 'People welcome me everywhere I go and when I get home I remember all the wonderful things that happened in each country.' Nick has travelled to many places but there are a few trips that he would still like to make. 'I'd love to visit South America and go back to Australia one day,' he says.
On each trip, Nick travels with a team of people. They bring the cameras and other filming equipment needed to make the programme. Nick doesn't take a lot of things for himself, just a few shirts and trousers, but he always makes sure he has some books in his suitcase.
Nick's wife, Helen, doesn't mind him travelling for his work. She has a lot of friends and keeps busy. When he gets back, she likes to listen to all his travel stories. But sometimes there are problems. When he was in the Malaysian rain forest, Nick heard that his wife was ill in hospital. 'I felt terrible because I couldn't help, but she didn't want me to come home. I was so happy when I heard she was better.'",1
3,"Richard Cork recalls how, as an 78-year-old student, he came face-to-face with one of the most revered artists of the century.",4
4,"Dolphins hold a special place in our affections. They are among the most intelligent animals we know, they are sensitive to human emotions, and they allow us to dream of wonderful freedom out in the wild seas. 
This love affair has been encouraged by TV. First there was Flipper, and now there's Darwin, the star of Seaquest. However, these happy portrayals hide the reality of life for dolphins in the polluted and overfished seas of the 
late twentieth century.
The population of North Sea harbour porpoises (one kind of dolphin) is estimated to have been reduced by up to 89,000. You may expect such popular animals to be protected by law and taken care of in special marine reserves. This is not the case, however, and the lack of plans to look after them may become one of the biggest wildlife disasters of our times. 
Forty different kinds of dolphins are recognised worldwide. In the waters of northern Europe, the greatest number of dolphins are the striped, the common, the bottlenose dolphins, and the smaller harbour porpoise. The first two generally live far out in the open sea. They are normally seen only in small groups, flashing quickly past ships, and we know very little about them. 
The large grey bottlenoses and harbour porpoises, on the other hand, were once a common sight near to European coasts. Bottlenoses are particularly social and used to be found on the Channel coast and in river mouths in Britain, including the Thames. Resident populations can nowadays be found only in the Moray Firth in Scotland and Cardigan Bay in Wales, and the skin injuries found on the few that still remain indicate that they are suffering from stress. 
The complicated habits of the dolphins make it difficult to decide on the exact reasons for this reduction in numbers. The overfishing which is dramatically reducing the world's fish stocks and which is threatening to destroy local fishing industries, also threatens porpoises and dolphins. This is because porpoises have to find their food within a limited time. If fish in one area are removed by fishing, they may not survive long enough to find food elsewhere. 
They are also in danger of getting caught in fishermen's nets which are thought to be invisible to them. In many modern fishing methods, huge nets are left to float or are pulled at great speed through the sea. In recent years, hundreds of dead dolphins have been washed up on the beaches of France and Cornwall. Marks, ropes and cuts on their bodies show that the main cause of death was the fact that they had been caught by such nets. 
Waste and other substances found in the sea can be stored in the bodies of dolphins. One example is what happens with pesticides: these poisons are soluble in fat, which means that the dolphins can digest them and they can build up in their bodies. The females then produce milk that is rich in pesticides, thus passing the poison in a concentrated fashion on to their young. There is already one recorded case of a young dolphin being poisoned and killed by its mother's milk. 
But perhaps the most controversial threat to dolphins is the one posed by human disturbance. Dolphins live in groups and receive information about much of their world through sound. In the sea, noise pollution - from ships, oil wells and so on - is transmitted four times more efficiently than in the air. This may disturb the dolphins in ways that we do not yet 
understand. ",3
5,"The school's swimming instructor was an ex-drill sergeant, small and muscle-bound, with tattooed arms. When I asked him to teach me how to dive, he told me to sit on the pools edge, put my hands above my head and roll forwards, pushing myself off with my feet. I practised that manoeuvre until the hour was up. The next visit, he got me standing upright, and diving off the edge. The instructor was a martinet and every time I surfaced he looked at me with distaste: 'Don't look down, look up!' 'Keep your legs straight.' 'Point your toes I said!' The next week, I went up onto the high board. It was a fixed board and its front edge bent slightly downward. It seemed outrageously high as I stood there, trying to work up my courage. Gradually the echoing voices disappeared and I felt as if I were cocooned in silence. I waved my arms vaguely in the way I'd been taught, tried to look up, not down, and launched myself into space. For a brief moment, I was flying. When I hit the water, I crumpled ignominiously, and my legs were all over the place. The instructor looked at me with contempt and shook his head. But even he could not diminish my euphoria. That's what they mean by 'free as a bird', I thought.",5
6,"Richard Nerurkar, one of Britain's top 10,000-metre runners, visits the Kenyans' high-altitude training camp.",4
7,"B.
John van Maurik, director of a Leadership in Management course, says, 'Most people have a far greater potential for leadership than they realise. The process of becoming a leader is recognising those latent talents, developing them and using them.'
In one sense, we are all born leaders - we just need the right circumstances in which to flourish. While it's quite easy to recognise leadership in the grand sense -- be it in the form of figures like Emmeline Pankhurst, Mahatma Ghandi or even Richard Branson - it may be more difficult to relate it to our own workplace. And yet this quality is now regarded as the cornerstone of effective management.
 ",4
8,The soles 1940 Oil on canvas Scottish National Gallery of Modern Art,5
9,"Emma and her friends are pursuing a holiday game -- surveillance of a suspicious bookshop -- when she realises that one of its rare customers is her
Uncle Jim.
He callously draws her into a web of deceit and crime, manipulating her affection for him and attempting to alienate her from her friends, whose characters are persuasively drawn by Coppard.
When Emma finds her life in danger, things take a dark and compelling turn - her confinement in the cellar of a derelict house is stunningly handled.
This book reveals the minutiae of family life, the bonds of childhood friendship and warns that adults aren't always the protectors they ought to be. A vital and convincing read.",4
10,"A limited number of major treks are offered for strong mountain walkers. These sometimes involve walking at elevations over 10,000 feet, with substantial altitude gains and losses during a single day. We may lodge with the local people or rough-camp in the world's great mountain ranges like the Atlas, Kackar, Himalayas and Andes. Or we use a mixture of well-appointed camp-sites and alpine chalets in more sophisticated mountain areas such as the Alps. Such trips usually involve support vehicles, porterage or pack animals. We rarely backpack or carry heavy gear.",4
11,"Going Home
This drama was very sad sometimes, and was difficult to watch. An old dog travels across the country to find its owners. The dog is welcomed by many people, but all the dog wants is to find its family. A wonderful movie, but sad!   
",0
12,"Another of the most famous modern apples was discovered in Australia by Maria Anne Smith. The daughter of transported convicts, Maria was fiercely independent, rejecting both the criminal life of her parents and the bureaucratic hypocrisy of the colonial administration. She worked as a midwife in the small township of Eastwood in New South Wales, where she was known as 'Granny-Smith' because she took on responsibility for maintaining the farm and orchard, which was the family's main source of income. One day in 1868 she found a small tree pushing its way through a pile of discarded fruit. She transplanted it and before long was harvesting the world's first major crop of green apples, soon to be famous all over the world. When asked how the tree came about she said, 'Well, it's just like God to make something useful out of what we think is rubbish' - a comment which referred not only to the fruit but also her own convict origins.",4
13,"We are Talking Big Boots here. Really BIGTIME Boots.
I stood in my 800-dollar-each designer-label cowboy boots on the rocks of an old formation in the Arizona desert sand. Money no object. I wore the whole truly cowboy outfit and if you had the outfit you might be a cowboy. But I was not. It wasn't working. I squinted info the morning sun looking out at the Arizona mountains and I had to admit, I was not at home on the range,
Flying in from Denver just after dawn, I had the feeling that I just might pass far an ol' cowhand coming in from the sky. The feeling didn't last past the first real cowboy in the luggage hall of Phoenix airport. He was wearing a sweat-stained I-shirt, needed a shave, and was hoisting a dirty canvas bag off the conveyer belt when he caught sight of my brand new cowboy boots. He slowly raised one eyebrow and moved off out of the door without looking back.
There ought to be, somewhere, hanging in a closet, a suit of clothes an ex-racing driver can put on without feeling like he is from another planet. Something he could wear so that wherever he goes he doesn't get the feeling that everybody is talking another language and doing whatever they do at half speed. I liked, no, not liked... I flatout loved being a racing driver, driving racing cars. I am addicted to it and it is all I know how to do. But I don't do it any more. I couldn't if I wanted to. Question is, I thought, looking into the mean, rust-coloured rock of the mountains in the distance, what do I do now?
A racing driver should have one or two fall-back identities lined up for when he climbs out of his car. I thought I did, but when I reached for them they just disappeared. How about: an ex-racing driver adds colour to the commentary direct from the trackside? 'We got fifteen guys, all of them former Indy and Formula One drivers, fifteen guys in front of you, Forrest, standing in line to be colour commentators. We'll call you.'
Well then, how about: an ex-racing driver coins a partnership to sell classic cars? That lasted nearly all winter with phone calls, lunches, lawyers und meetings with bankers. But it was the year nobody was buying old Ferraris and Honda was 'reviewing' its dealer list. So in the end I gracefully withdrew before there was nothing to withdraw from. Being an 'ex' anything is depressing work. I mean you tell me, how badly do you want to hear about how I was almost the World Champion? Nobody wants to hear a story that ends in 'almost'. And even if I had been world champion you could probably just about stand to listen to the story for five minutes before your ears turned to cement. Last year's champion was last year.
Not that I want sympathy. Which is just as well, since I don't get any. Well, why should I? I had a good run, made money and hung on to enough. But oh, man, I miss the heat of slipping into that graceful, elegant, shrink-wrapped super-tech machine with seven hundred horsepower behind my neck. Zero to a hundred and fifty miles an hour in 4,9 seconds. And yes, I miss coming within an eyelash of killing myself every race or so. I miss the bright and gorgeous people and the reporters who acted as if what I said mattered. Being famous, even in a minor way, isn't all bad. Businessmen and politicians bragged to their friends that they knew me. Little boys slid under fences to get my autograph. And now that I don't drive a racing car... Only last week the phone rang twice. I have time in the morning and I have time in the afternoon. And let me just check, but I think tomorrow is free, so much empty time.
I looked up into the soft blue morning sky. No buzzards overhead. Maybe Arizona doesn't have buzzards. But a couple of little brown birds in a saguaro cactus just in front of me were giving me advice, something like 'get away from our nest before we sing our hearts out'. It had never occurred to me that the desert had songbirds. It did occur to me that a bogus cowboy in designer boots had a lot to learn.",5
14,"Up until quite recently, I would have said that opera is first and foremost theatre. Not any more. After a brief spell working at u national opera house, I learned that opera is, in fact, only secondly theatre. The music comes first. That's as it should be, of course. But I come from a different world, the world of the theatre, where the word and the actor speaking it have primacy, where there is nobody out front directing the action once the event is under way, and where performer and audience (mostly) speak the same language.
At any musical performance, whether in concert hall or opera house, there will generally be a substantial minority of people who, like me, have little technical or academic understanding of music. Some of them will be aware of, possibly even embarrassed by, how much they don't know. Most will be awestruck by the skill of the performers. A dazzling coloratura or an impeccable string section are easy to admire. Even a moderately good musician is showing us the results of years of punishingly hard work. Being in the audience for top-class music is not unlike watching an athletics match - we know athletes are doing something broadly similar to what we do when running for a bus, but we also recognise by how much it excess our best efforts.
Theatre audiences by contrast, come with a different set of expectations. In the main they do not understand the nature of an actor's skill and are not particularly awed by an activity which, a lot of the time, appears to be very close to what they could do themselves. They are not usually impressed when an actor completes a long and difficult speech (although 'how do you learn all those lines?' is the question every actor gets asked). None of this means that theatre audiences are more generous or less demanding than their counterparts in the concert hall, indeed quite a lot of them are the same people. What perhaps it does mean is that audiences and performer meet on more equal terms in the theatre than elsewhere, no matter how challenging the material or spectacular the event. The question is, does music need to learn anything from the theatre about this relationship? I would say yes, partly because I have seen how a different approach can transform the concert-goers experience.
Music in live performance is inherently theatrical, full of passion, humour, melancholy, intimacy, grandeur, vulnerable to the possibility that something will go unexpectedly wrong, reaching into the imagination of the listener not just as an individual but as part of a collective. The conventions which still largely dominate music presentation, including strict dress codes and an exaggerated deference to the status of conductors and soloists, emphasise the difference between players and listeners in a way which often feels uncomfortably hierarchical. On the other hand, the tendency of contemporary music audiences to interrupt the momentum of performance by applauding between movements or after a canicular piece of virtuosity, while it is often a spontaneous expression of appreciation, can also be insensitive to the dramatic integrity of the whole work.
Is there anything to be done? Of course a huge amount is being done. Pioneering work is going on all over the country to encourage new audiences into concert halls and opera houses, and to break down the barriers that make people feel that 'serious' music is not for them. I remember a remarkable event, the staging of Jonathan Dove's community opera In Search of Angels, which followed the action from location to location within a cathedral and then out into the town. It was a musical experience of the highest order, in which the skills, and the generosity, of the professional musicians were absolutely central and it was also life-changing for many of the audience, who were not just there to see and hear but also to contribute directly.
Perhaps what I yearn for in music is a bit more of the risk and radicalism that theatre at its best can display. Sometimes it can come from the use of unfamiliar or challenging locations, where normal expectations are disrupted. This can have startling effects on performer and audience alike. Comforts may have to be foregone, perhaps the acoustic isn't great, maybe it's a bit cold, but theatre audiences have learned to be intrepid as they follow artists into the most unpromising spaces. I accept that most plays get put on in a pretty uncontroversial way, not greatly different from what happens in a conmen hall. However I remain convinced that something can and should happen to change the conventions of music-going. The only authority I can claim is that of the enthusiast: I love, and live by, the theatre and I spend as much time (and money) as I can going to hear music. I want them both to thrive, and for more and more people to get the pleasure I get from being the audience. ",5
15,"We were in a snow cave 91m below the summit when my climbing partner, Dougal Haston, began a conversation with Dave Clark, our Equipment Officer, about the relative merits of various sleeping bags. I thought this was strange, as only Dougal and I were present. Putting this down to oxygen deprivation, I then found myself talking to my feet. Already the cold was getting into the balls of my feet and I recalled other climbers who had lost fingers and toes from frostbite. It wasn't survival that was worrying us so much as the quality of our survival.
Over the next two days I relived our time spent on the summit ridge. I realised that I couldn't have been there with a better man than Dougal Hatton. He inspired great confidence in me and by now I was climbing with a calm presentiment mat somehow or other it was all going to work out. I realised I had to get a better rhythm going in order to reach the summit - which is what I did.",4
16,"'From the moment Sarah sat on a horse, age 1, that was it, her passion. When she was 5, she used to get up before us all to exercise her pony. To qualify for major shows you have to jump all over England. To save money, we sleep in the living quarters of our horse box. Sarah is well organised. She is 100% happy on a horse, she knows what she's doing. Watching your child succeed at something they love is hard to beat.' ",3
17,"My image of china-painting stemmed from a visit, long ago, to an arts and crafts exhibition where stern-looking grey-haired ladies demonstrated how to cover a teacup with delicate flowers using a series of deft brushstrokes. The spectacle was riveting, because each stroke formed a perfect petal or leaf. Their hands never wobbled, the paint never smudged, and the observer might have concluded that these women had either been practising their art for decades or had been born with an extraordinary talent for steady precision.
Mindful of this experience, I wondered what kind of people would have the courage to enrol on a course in china-painting. Would even the beginners display an intuitive artistry? In fact, the atmosphere turned out to be far from intimidating. The students were all there to have fun and not even the tutor wanted to paint petals on teacups with the robotic rapidity I had remembered.",5
18,"Human beings have been munching apples since prehistoric times. They spat out apple-pips in neolithic Britain. And 10,000 years ago they left apple remains to carbonise around their Swiss and Italian lakeside homes. In Switzerland and in the regions adjoining the Caucasus mountains, ancient humans even appear to have dry-stored apple-halves for winter. But these were wild crab apples, tiny wizened fruit which, in Ancient Britain came to be known as 'windings'. They had little in common with the apples we know today.",4
19,"Peter James' production of Harley Granville Barkers rich, panoramic comedy about fashion and the position of women in Edwardian society transfers to London after its success at the Edinburgh Festival. The staging is stylish, the acting excellent, the play itself an unjustly neglected classic.
Lyric Theatre, Hammersmith, London W6 (0208 741 2311)",4
20,"There are many different kinds of cats. They are different in size and they do not look or act the same. 
Tigers are the biggest cats. From head to tail they can be 3.7m long. Most cats don't like water, but tigers will often lie in a pool of water when it is hot! 
Lions are the only cats that stay together in large family groups. Several lions may work together to get food for the group. They usually live in flat, open countryside where they can see a long way and easily follow other animals. 
All cats need good eyes, because they catch smaller animals for their food. They also need to be fast, and very strong. ",1
21,"Cambridge Brass Rubbing Centre, the second oldest and longest surviving centre in the world, is one of the regions most unusual tourist attractions. Hours of enjoyment are to be had creating wall hangings by rubbing one of over a hundred different brass plates off tombs of medieval knights and ladies. By formulating resin copies, known as facsimiles, the centre has made it possible to preserve the originals and still make brass rubbing an accessible pastime to all. The brass plates, as an alternative means of memorial to the tomb statue, spread from Germany across medieval Europe and Scandinavia. Through various revolutions most of the beautiful brasses were destroyed. The vast majority of remaining brasses are to be found in Britain and the widest range of examples can be seen at the Cambridge Centre.",4
22,"Throughout our childhoods, Lydia and I distrusted any prize-winning book because we knew it would be worthy; and for 'worthy', read 'boring', we thought.
While our mother had been inclined to abhor our philistinism in tones of despising innuendo, our father would cheerfully dish us out tenpences, chapter by chapter, as inducements to make us cast our eyes over the occasional improving volume. Or he would slip the odd superior book in amongst our Christmas and birthday presents, labelled in bold marker pen, 'This Book is NOT Literature'. Though we dismissed most of his offerings as 'boys' books', he did, in this way, expose us to some shorter works of decent fiction and, just once, to a well-known anthology of verse.",5
23,"Visiting the theatre in London 400 years ago was very different from visiting a modern theatre. The building was round, there was no roof, and people got cold and wet if the weather was bad. The queen loved going to the Globe Theatre, by the River Thames, to see the plays of William Shakespeare. All the actors at that time were men. The visitors ate, talked to their friends, walked about during the show, and some people even threw things at the actors! 
Today, it is still possible to visit the Globe Theatre. A new theatre stands in the same place near the river. You can enjoy a Shakespeare play there or just learn about life in the seventeenth century. 
",1
