,Text,Level
45,"Southwell in Nottinghamshire is full of surprises. The first is Britain's least-known ancient cathedral, Southwell Minster, celebrated by writers of an environmental disposition for the pagan figures of 'green' men which medieval craftsmen carved into the decoration in its thirteenth-century chapter house. The second, appropriately enough, is Britain's greenest dwelling, the 'autonomous house', designed and built by Robert and Brenda Vale. 
The Vales use rainwater for washing and drinking, recycle their sewage into garden compost and heat their house with waste heat from electrical appliances and their own body heat, together with that of their three teenage children and their two cats, Edison and Faraday. You could easily miss the traditional-looking house, roofed with clay pantiles, on a verdant corner plot 300 yards from the Minster. It was designed to echo the burnt-orange brick of the town's nineteenth-century buildings and won approval from the planners even though it is in a conservation area.
Ring the solar-powered doorbell and there is total silence. The house is super-insulated, with krypton-filled triple-glazed windows, which means that you do not hear a sound inside. Once inside and with your shoes off (at Robert's insistence), there is a monastic stillness. It is a sunny summer's day, the windows are closed and the conservatory is doing its normal job of warming the air before it ventilates the house. Vale apologises and moves through the house, opening ingenious ventilation shafts and windows. You need to create draughts because draught-proofing is everywhere: even Edison and Faraday have their own air-locked miniature door. 
The Vales, who teach architecture at Nottingham University, were serious about the environment long before it hit the political agenda. They wrote a book on green architecture back in the 1970s, The Autonomous House. They began by designing a building which emitted no carbon dioxide. Then they got carried away and decided to do without mains water as well. They designed composting earth closets, lowered rainwater tanks into the cellar, and specified copper gutters to protect the drinking water, which they pass through two filters before use. Water from washing runs into the garden (the Vales don't have a dishwasher because they believe it is morally unacceptable to use strong detergents). Most details have a similar statement in mind. 
'We wanted people to see that it was possible to design a house which would be far less detrimental to the environment, without having to live in the dark,' says Robert. 'It would not be medieval.' The house's only medieval aspect is aesthetic: the hall, which includes the hearth and the staircase, rises the full height of the building.
The Vales pay no water bills. And last winter the house used only nine units of electricity a day costing about 70p -- which is roughly what other four bedroomed houses use on top of heating. Soon it will use even less, when PS20,000 worth of solar water heating panels and generating equipment arrive and are erected in the garden. The house will draw electricity from the mains supply for cooking and running the appliances, but will generate a surplus of electricity. There will even be enough, one day, to charge an electric car. The only heating is a small wood-burning stove in the hall, which the Vales claim not to use except in the very coldest winter.
So is it warm in winter? One night in February when I happened to call on him, Robert was sitting reading. It was too warm to light the fire, he said. The room temperature on the first floor was 18C, less than the generally expected temperature of living areas, but entirely comfortable, he claimed, because there are no draughts, no radiant heat loss, since everything you touch is at the same temperature. Perceived temperature depends on these factors. An Edwardian lady in the early years of the twentieth century was entirely comfortable at 12.5C, he says, because of the insulation provided by her clothing. Those people who live in pre-1900 housing, he suggests, should simply go back to living as people did then. Somehow, it is difficult to think of this idea catching on. 
The house's secret is that it is low-tech and there is little to go wrong. Almost everything was obtained from a builder's merchant and installed by local craftsmen. This made the house cheap to build -- it cost the same price per square metre as low-cost housing for rent. Not surprisingly, the commercial building companies are determinedly resisting this idea.",4
46,"Our wildlife safaris visit many of the world's greatest game parks and offer a thrilling encounter with animals in their natural state. Choose from dozens of remarkable destinations. In Africa, for example, you often have the freedom to step outside your safari vehicle and tackle the wild terrain for yourself. You could track the rare silver-back mountain gorilla in Zaire, go bush walking with tribal guides in Uganda, climb Mount Kenya, ride a canoe on the Zambezi River or a traditional mokoro in the Okavango Delta. Most African safaris camp, and full camping equipment is provided. A few offer hotel and lodge accommodation throughout. Elsewhere, in Asia and South America, on trips which include game viewing - say, our tiger safari in India - we usually stay in hotels, resthouses and jungle lodges. In Darwin's famous Galapagos Islands we live aboard a small motor yacht.",4
47,"Hockney's work appeals to a great many people who might otherwise display little interest in art. It may be that they are attracted to it because it is figurative and, therefore, easily accessible on one level, or because the subject matter of leisure and exorcism provides an escape from the mundanities of everyday life. Perhaps it is not even the art that interests some people, but Hockney's engaging personality and the verbal wit that makes him such good copy for the newspapers. He may, in other words, be popular for the wrong reasons. But does this negate the possibility that his art has a serious sense of purpose?
In the view of some respected critics, Hockney is nothing more than an overrated minor artist. To this one can counter that Hockney might seem minor because it is unacceptable today to be so popular, rather than because his work is lacking in substance. Hockney himself is not self-deluding; he is aware of his limitations and thinks that it is beside the point to dismiss his work because it does not measure up to an abstract concept of greatness. Hockney does not claim to be a great artist and is aware that only posterity can form a final judgement on his stature.",5
48,"Simon Costello knew that the purchase of the house in Pembroke Square had been a mistake within a year of his and Lois's moving in. A possession which can only be afforded by the exercise of stringent and calculated economy is best not afforded at all. But at the time it had seemed a sensible, as well as a desirable, move. He had had a run of successful cases and they were coming in with reassuring regularity. Lois had returned to her job at the advertising agency within two months of the birth of the twins, and had been given a rise which took her salary to thirty-five thousand. It was Lois who had argued the more strongly for a move, but he had put up little resistance to arguments which at the time had seemed compelling: the flat wasn't really suitable for a family, they needed more room, a garden, separate accommodation for an au pair. All these, of course, could have been achieved in a suburb or in a less fashionable part of London than Pembroke Square, but Lois was ambitious for more than additional space. Mornington Mansions had never been an acceptable address for an up-and-coming young barrister and a successful businesswoman. She never said it without a sense that even speaking the words subtly diminished her standing, socially and economically.
Lois had decided that a necessary economy was for one of them to travel by public transport. Her firm was on the other side of London; obviously Simon must be the one to economise. The overcrowded tube journey, stayed in a mood of envious resentment, had become an unproductive thirty minutes of brooding on present discontents. He would recall his grandfather's house in Hampstead where he had stayed as a boy, the smell of dinner from the kitchen, his grandmother's insistence that the returning breadwinner, tired from his exhausting day in court, should be given peace, a little gentle cosseting, and relief from every petty domestic anxiety. She had been a 'lawyer's wife', indefatigable in legal good causes, elegantly present at all lawyers' functions, apparently content with the sphere of life which she had made her own. Well, that world had passed for ever. Lois had made it plain before their marriage that her career was as important as his. It hardly needed saying, this was, after all, a modern marriage. The job was important to her and important to them both. The house, the au pair, their whole standard of living depended on two salaries. And now what they were precariously achieving could be destroyed by that self-righteous, interfering Venetia.
Venetia must have come straight from the court to their offices and she had been in a dangerous mood. Something or someone had upset her. But the word 'upset' was too weak, too bland for the intensity of furious disgust with which she had confronted him. Someone had driven her to the limit of her endurance. He cursed himself. If he hadn't been in his room, if he'd only left a minute earlier, the encounter wouldn't have taken place, she would have had the night to think it over, to consider what, if anything, she ought to do. Probably nothing. The morning might have brought sense. He remembered every word of her angry accusations.
'I defended Brian Cartwright today. Successfully. He told me that when you were his counsel four years ago you knew before trial that he had bribed three of the jury. You did nothing. You went on with the case. Is that true?'
'He's lying. It isn't true.'
'He also said that he passed over some shares in his company to your fiancee. Also before trial. Is that true?'
'I tell you, he's lying. None of its true.'
The denial had been as instinctive as an arm raised to ward off a blow and had sounded unconvincing even to his own ears. His whole action had been one of guilt. The first cold horror draining his face was succeeded by a hot flush, bringing back shameful memories of his headmaster's study, of the terror of the inevitable punishment. He had made himself look into her eyes and had seen the look of contemptuous disbelief. If only he'd had some warning. He knew now what he should have said: 'Cartwright told me after the trial but I didn't believe him. I don't believe him now. That man will say anything to make himself important.'
But he had told a more direct, more dangerous lie, and she had known that it was a lie. Even so, why the anger, why the disgust? What was that old misdemeanour to do with her? Who had sent Venetia Aldridge to be guardian of the conscience of their legal practice? Or of his, come to that? Was her own conscience so clear, her behaviour in court always immaculate? Was she justified in destroying his career? And it would be destruction. He wasn't sure what exactly she could do, how far she was prepared to go, but if this got about, even as a rumour, he was done for.",5
49,"I may be too old for this lark, but here goes!
At 34, Tim Pozzi has left a good job to go backpacking. He ponders what has made him -- and others of hi sage -- take the plunge.
This summer, I quit my job and resolved to rent out my flat and go travelling in South East Asia for a yeaL You might think I'm lucky, but I'm 34 years old, and I'm nervous.
It's not as if I haven't done the travelling thing before. After university, I spent two years backpacking around North and South America, and when I returned. was determined to do it again some day, But you know how it is ... I fell in love, embarked on a career, bought a Hat and got used to earning a salary. But I gradually realised I had been sacrificing my own sense of worth for my salary. When I handed in that letter of resignation, it felt as though I'd taken charge of my life again.
I now have no tics. Many of my friends are now married with children and, while they wouldn't swap places with me, they envy me my lack of responsibilities. I'm no longer in a relationship, and I have no burning career ambitions. I feel almost obliged to make the most of that freedom - if only for my friends' sake!
Why am I so nervous? In the first place, 1t's a question of making the necessary arrangements. How could I bear to have someone else living in my home? And how would I go about organising the letting? And apart from anything else, I had to decide where to go.
T'm a shocking procrastinator. and am already several weeks behind my intended schedule. 'Might as well enjoy the summer in England,' I told myself. Then, 'Why not hang around for the start of the football season?' Severing emotional ties makes it even more difficult.
I'm putting it off because, deep down, I wonder if I can still cope with backpacking. Will I be able to readjust to a more basic wav of life? Will I feel out of place among a community of backpackers fresh out of school and university?
Perhaps not. I've discovered it's increasingly common for Britons in their late twenties and thirties to want to disentangle themselves from the lives they've made for themselves and head ofT for foreign climes.
Jennifer Cox, of Lonely Planet guidebook publishers, identifies a growing awareness that adventure is there for the raking: 'The penny's dropped. The sort of people who always say ""I wish I'd had that opportunity"" are realising that they can have it any time they want. They just have to be brave enough and organised enough and confident enough to do it.'
1-'0I' Danny, a 30-year-old accountant, and his girlfriend Tammy, a 28-year-old teacher, it's a chance to have a final fling before settling down. They have bought 'I round-the-world ticket for a year. 'I'm prepared to sacrifice job security to have the trip,' says Danny. 'There's always a niggling thought at the back of your mind that. ""OK, I'm not moving up the career ladder, I'm going to be in the same position I was in before when I come back,"" but I think it's a risk you have to take, When I left the office, I threw my calculator into the river as a ceremonial act of defiance!'
For Matt, who'd just got out of the Army, the year he spent travelling amounted to a period of metamorphosis. 'When you're in the military, there's a set wav of doing things, a pattern to the way you approach problems. I went away because I really needed to temper this, and get rid of this approach in some cases, in order to have a reasonable existence as a civilian.'
While there are as many reasons to go travelling at my time of life as there are travellers, there do seem to be common factors. 'We have a much more flexible workforce today,' says Angela Baron of the Institute of Personnel Development. 'There are more people working on short-term contracts and so if your contract's just come to an end you've got nothing to lose.' Larger companies are even adopting career-break policies. 'If you've spent a lot of time and money training someone, it's nice to know they're coming back at some point rather than going to work for a competitor.'
For Dan Hiscocks, managing director of Travellerseye, a publishing company that specialises in the tales of 'ordinary' travellers, an increasing number of thirty-somethings are taking stock of their lives. 'If you're nor happy doing what you're doing - and many people aren't - it's no longer a question of just seeing it through. Now people are aware that opportunities exist and that a job isn't ""for life"" any more. Travel offers a chance to reassess, to take a step back and think about your life.'
Is giving in to wanderlust just another example of my generation's inability to come to terms with adulthood? Jennifer Cox thinks nor. 'It's a sign of a better educated, more stable society when we're less concerned with paving the bills than wanting to live a balanced life. We're actually taking the time to ask ""Is this what I want?""
Ben, a 32-year-old picture researcher heading off to Central America for a year , does nor believe he's running away. 'It's more a case of running towards something. It's trying to grab some things that I want for myself' But he does feel some trepidation. 'It's the thought of what I'm leaving behind, that comfortable routine - just the act of going into the office every day. saying ""hi"" to everyone and sitting down with a cup of coffee.'
I share Ben's reservations about leaving behind an ordered life with few challenges and I'm nor sure I'd be making this journey if [ hadn't found my boss so intolerable. As Jennifer Cox points out: 'This is fairly typical. There's often a catalyst. like the break-up of a relationship or the loss of a job. Such an event can push people to go and do it.'
It may have taken a helpful kick up the backside to get me moving, but I'm now approaching the next 12 months with a mounting sense of excitement. Whatever the outcome, I'll be able to take satisfaction in having grabbed life by the horns. And in that I'm sure I speak for all of us ageing backpackers.
",4
50,"'The origin of human language is truly secret and marvellous', wrote Jacob Grimm in 1851. The marvellous secret has long proved a launch pad for strange ideas. 'Primitive man was likely to make sounds like ""meuh"" when sensing danger,' claimed Charles Caller in 1928. ""Meuh"" has a plaintive sound. The human who wandered over a hostile land inhabited by awesome beasts uttered desperate noises, and languages have preserved some echo of his lamentation such as malaria meaning ""fever"" or the Latin mors meaning ""death"".
Faced with such weird speculations, many avoided the topic, regarding it as a playground for cranks, but recently, language origin and evolution have become key research areas. Language probably developed in East Africa, around 100,000 years ago. In the main speech was used for friendly interaction, and was an important tool in power struggles. Information-swapping was probably not an important original role - contrary to the views of philosopher John Locke, who spoke of language as a 'great conduit' for conveying knowledge.",5
51,"When Bo the cat decided to explore a furniture van, she had a bigger adventure than she expected. She was discovered by the driver, after he had completed a trip of over 500 kilometres. It was the end of a long day. The driver and the cat were both hungry!He gave her some milk and started making enquiries. He telephoned his last customers, but they had not lost a cat. It was getting late, so he took Bo home for the night and next morning delivered her to an animal hospital. 
The cat's owner had done some detective work too. After searching everywhere for the cat, he suddenly remembered the furniture van which had made a delivery to a neighbour. Fortunately, he remembered the name of the company. He called their office and in a short time Bo was returned safely. ",2
52,"Good Morning Mr. Smith,
Thank you for telling me about the book ""The Other Side of the Mountain"", it was very good. I read it in only 3 days! I wrote some notes in my notebook like you said, so I can use them for my homework. What other books do you think I should read?
Best,
Johnny",0
53,"Much as I admire sands miraculous ability to be transformed into useful objects like glass and concrete, I am not a great fan of it in its natural state. To me it is primarily a hostile barrier that stands between a seaside car park and the water itself. It blows in your face, gets in your sandwiches, and swallows vital objects like car keys and coins. When you are wet it adheres to you like 'stucco', and cannot be shifted, even with a fireman's hose. But, and here's the strange thing, the moment you step onto a beach towel, climb into a car or walk across a recently vacuumed carpet, it pours off you. For days afterwards, you tip mysteriously undiminishing piles of it onto the floor every time you take on your shoes, and spray the vicinity with lots more when you peel off your socks. Sand stays with you for longer than many contagious diseases. No, you can keep sand, as far as I am concerned.",5
54,"Young Shoppers
Supermarket shopping with children, one mother says, is absolute murder: 'They want everything they see. If it's not the latest sugar- coated breakfast cereal, it's a Disney video or a comic. Usually all three. I can't afford all this stuff and, anyway, if I agree to their demands I feel I've been persuaded against my better judgement and I feel guilty about buying and feeding them rubbish. Yet I hate myself for saying no all the time, and I get cross and defensive in anticipation as we leave home. I do my best to avoid taking them shopping but then I worry that I'm not allowing them to have the experience they need in order to make their own choices. I can't win.'
Research has found that children taken on a supermarket trip make a purchase request every two minutes. More than PS150 million a year is now spent on advertising directly to children, most of it on television. That figure is likely to increase and it is in the supermarket aisles that the investment is most likely to be successful. For children, the reasons behind their parents' decisions about what they can and cannot afford are often unclear, and arguments about how bad sugar is for your teeth are unconvincing when compared with the attractive and emotionally persuasive advertising campaigns.
According to Susan Dibb of the National Food Alliance, 'Most parents are concerned about what they give their children to eat and have ideas about what food is healthy - although those ideas are not always accurate. Obviously, such a dialogue between parents and children is a good thing, because if the only information children are getting about products is from TV advertising, they are getting a very one-sided view. Parents resent the fact that they are competing with the advertising industry and are forced into the position of repeatedly disappointing their children.' The Independent Television Commission, which regulates TV advertising, prohibits advertisers from telling children to ask their parents to buy products. But, as Dibb points out, 'The whole purpose of advertising is to persuade the viewer to buy something. So even if they cannot say, ""Tell your mum to buy this product,"" the intended effect is precisely that.'
A major source of stress for some parents shopping with children is the mental energy required to decide which demands should be agreed to and which should be refused. One mother says she has patience when it comes to discussing food with her children, but she still feels unhappy about the way she manages their shopping demands: 'My son does pay attention to advertisements but he is critical of them. We talk a lot about different products and spend time looking at labels. I've talked about it so much that I've brainwashed him into thinking all adverts are rubbish. We have very little conflict in the supermarket now because the children don't ask for things I won't want to buy.'
Parents also admit they are inconsistent, even hypocritical, in their responses to their children's purchasing requests. Mike, father of a son of seven and a daughter of three, says, 'We refuse to buy him the sweets he wants on the grounds that it's bad for him while we are busy loading the trolley with double cream and chocolate for ourselves. It's enjoyable to buy nice things, and it's quite reasonable that children should want to share that, I suppose. But I still find myself being irritated by their demands. It partly depends on how I feel. If I'm feeling generous and things are going well in my life, I'm more likely to say yes. It's hard to be consistent.'
Supermarkets themselves could do a lot more to ease parent-child conflict by removing sweets from checkout areas or even by providing supervised play areas. Although parents might spend less because their children are not with them, the thought of shopping without your six-year-old's demands would surely attract enough extra customers to more than make up the difference.",3
55,The Grand Canyon in the United States was created by the River Colorado. People visit the Grand Canyon Park to go walking and running but mainly to look at the view. It is a wonderful view made even better by the Skywalk. The distance from the Skywalk to the bottom of the Grand Canyon is 1219 metres. It is a platform whose walls and floor are built of glass so that you can see the beautiful rocks of the canyon. Up to 120 people are allowed to stand on it at the same time. It opened in 2007 and since then thousands of people have used it. You have to wear special covers over your shoes to avoid scratching the glass beneath your feet. Walking onto the Skywalk makes you feel like a bird floating high up in the air. ,2
56,Never try to pretend that you are not taking a picture of someone when it is clear that you are as this only creates tension and even hostility. Most people will agree to have their picture taken - perhaps after some initial protestations - and are quite flattered by it. But they are likely to become rather self-conscious and you may need to direct them. A picture can be spoiled by the fact that the subject is looking rather aimlessly out of the picture so that the interest lies elsewhere.,4
