,Text,Level
97,"'I'm afraid Kira will be a little late,' the receptionist at the agency told me. 'Oh, fine,' I said, 'no problem.' I had been trying to convince myself that all the bad things I had read about models were rubbish, but the words difficult, vain and unintelligent kept coming into my head. And now she was going to be late. How late? An hour? Three hours? Maybe she wouldn't come at all. What if she had decided a visit to the hairdresser's would be more fun than talking to me? If she was late, she would be rushing. She could be in an awful mood and refuse to answer my questions. 
But when the winner of the Looks magazine supermodel competition walked in, she was smiling, relaxed and apologetic and with her mother. Kira was not dressed in expensive-looking designer clothes but in a simple black dress and trainers. There was no sign of a selfish attitude, she was just a very friendly, very tall, very pretty girl. All models under the age of 16 must take an adult with them whenever they work, she explained, and apart from looking incredibly young, her mother was a normal mum - visibly proud of her successful daughter. 
Kira gives the impression of being slightly puzzled by her new-found fame, which is understandable since it was completely unplanned. It was her older sister who decided that she should take part in the model competition. 'She saw the competition and said I should go in for it,' Kira remembers. 'I said no, but she sent some photos in anyway.' When the call came to tell her that she was a finalist, she was at school. 
The achievement of being selected for the final [line 38: beginning] gave Kira the confidence to go through with it and [line 38: end] she performed perfectly. She won easily and the Select model agency in London immediately offered her work. 
Kira now finds that one of the hardest things she has to do is to manage her two separate lives. But her friends and teachers have become accustomed to having a star among them. 'They're really proud of me,' she says. However, a few unkind people at her school are rude about her success. 'They say I have too high an opinion of myself.' This kind of remark must be hard for Kira to deal with, since there can't be many people as successful as her who are less self-important. But she says, 'They assume that because I've suddenly become a model, I can't stay the same. But the only thing that's changed is I've become more confident - not in a horrible way, but I'm able to stand up for myself more.' 
As a busy model though, her social life is obviously affected. The Select agency can ring at any time and tell her that she is wanted for a job the next day. 'If my friends are going out together, I can't say I'll come, because I don't know what I'm doing the next day. I can't really make plans, and if I do they sometimes get broken, but my friends are good about it. They don't say, ""Oh, you're always going off modelling now, you never have time for us"".' 
Kira has the looks, ability and support to have a fabulous career ahead of her. And not many people can say that before they even sit their school-leaving exams. I am about to finish the interview with the girl who has it all, and I ask what she would like to do as a career if she didn't have the outstanding beauty that seems certain to take her to the top of the profession. She pauses and replies: 'I'd like to do what you're doing.' ",3
98,"There are now numerous books which attempt to give guidance to researchers about qualitative research. While much has been written about the collection of data, the books are often silent about the processes and procedures associated with data analysis. Indeed, much mystery surrounds the way researchers analyse their data. Accordingly, we invited a range of social scientists who have engaged in qualitative projects to discuss the approaches that they used. The idea was to share insight and understanding of the process of qualitative data analysis rather than to produce a guidebook for the intending researcher. Such a task involves a process of demystification, of making implicit procedures more explicit. While this may sound straightforward, we have found it far from simple. We have therefore given our contributors the opportunity to present their work in a range of styles, which include autobiographical narratives and more impersonal forms.",5
99,"I work a set shift pattern, and when I'm on an early shift I leave the house at 6.00 am. At 7.00 am I relieve the night shift and take over one of the four control positions in the tower.
We have a rotating timetable, which means that I work for about an hour and a half at one of the stations, go off for half an hour and then come back to a different station. The air traffic controllers, a supervisor and the watch manager all sit near to each other and work as a team, controlling the aircraft movements.
In winter we deal with about 1,000 movements a day, and even more in summer. Night shifts are much quieter, and I usually get a chance to read up on new air traffic requirements between 12 and 4.00 am.
It's important to be really switched on in this job, so even if I'm only a bit under the weather I have no qualms about being off sick. I find the work quite stressful and it can take a while to wind down at the end of a shift. Eventually I'd like to be watch manager, and then maybe even general manager of the airport.",4
100,"In 1783, two French brothers built the first balloon to take people into the air. One hundred and twenty years later, in 1903, the Wright brothers built the first plane with an engine and flew in it. This was in the United States. Then, in 1918, the US Post Office began the first airmail service. 
Aeroplanes changed a lot in the next thirty years. Then, in the 1950s, aeroplanes became much faster because they had jet engines. 
In 1976, Concorde was built in the UK and France. It is the fastest passenger plane in the world and it can fly at 2500 kilometres an hour, so the journey from London to New York is only four hours.
Today, millions of people travel by aeroplane, and it is difficult to think of a world without them. ",1
101,"At the poor, shambling, noisy end of the family there's Sam - fat, overtalkative and awed by his supercool and sophisticated cousin,
Lisa, from the apparently rich end of the clan. When Lisa's privileged world crumbles, it's Sam who helps her to find some balance, out of which both gain a better sense of reality and the value of family.
The pace is slightly slow in parts but there's a gentle humour and the developing closeness of the two teenagers is convincingly handled. It could be interesting to both boys and girls, which is a bit of a rarity.",4
102,Frank Kermode examines the craft of review-writing from a practitioner's point of view.,5
103,"Week after week, British tabloid newspapers carry pictures which intrude into people's privacy and break the newspaper editors' code of practice. Although pop stars do pose for paparazzi on occasion, this is not typical. More usually, great damage is done to [line 6: beginning] individuals in the public eye when they see their most [line 6: end] private moments captured on the front page. Yet very few call on the services of the Press Complaints Commission (PCC), an organisation that was set up to deal with issues of this kind. 
Rarely, if ever, are these pictures in the public interest. Do intimate shots of pop stars help to detect a crime? In what way did the picture of a famous actress on a hotel bedroom balcony protect public health and safety? The actress has made a fuss about long-lens pictures in the past and since she was in a hotel, a place where, to quote the code of practice, 'there is a reasonable expectation of privacy', she had good cause for complaint, but she didn't take any action. 
That the PCC did not launch an investigation itself is a scandal. It should also be looking into the outrageous story published recently about a pop star's love life. The pop star, like the famous actress, has held back from making a formal complaint. Shouldn't the PCC [line 25: beginning] take the initiative on this and other shameful attacks? [line 25: end]
To begin with, this seems like a great idea. It would surely lead to many decisions against newspapers. These would be reported by their rivals and broadcast on TV and radio. The public would not be sympathetic and editors would have to refuse to publish such material. Even photographers would be affected, no longer finding it financially possible to spend their days hidden behind trees waiting to snap unsuspecting celebrities. 
If the PCC decided to take on this role of 'police officer', which it technically could, there would be several problems. How would it decide whether or not to launch an inquiry? Should it approach the victim and encourage him or her to make a complaint? And if the person involved still refused to do anything, should it proceed nevertheless? In addition, celebrities and members of royalty might well expect that any story involving them would be taken up, and then be outraged to find it wasn't. Above all, the role itself is too enormous. How could the PCC realistically monitor the whole of the British press: national, regional and magazines? 
Then there is the embarrassment factor to consider. However seriously someone's privacy has been invaded, would they really want the further embarrassment of an investigation? I suspect the majority simply want to put it behind them and get on with their lives. Of course, one or two may have other reasons for keeping quiet. A worse story may exist, that they have managed to keep from the press, and they realise that this may also become public knowledge if they complain. In other words, even the PCC might become the enemy. 
One British comedian also suffered at the hands of the press when he and his wife were secretly photographed on their honeymoon in the Caribbean. He didn't complain then, nor more recently, when he and his family were again victims of a sneak photographer during a family holiday. His reason for this was fear that the newspaper, News of the World, would re-run the pictures with a new story about his 'fury', saying that they thought it was just a bit of fun, and that, being a film star who made comedies, they thought he had a sense of humour. This fear is understandable. People believe they will again become targets if they dare to challenge the tabloids. It is hard to see an easy solution to this serious problem. ",3
104,"C.
At its worst, international volunteering can be imperialist, paternalistic charity, volunteer tourism, or a self-serving quest for career and personal development on the part of well-off Westerners. Or it can be straightforward provision of technical assistance for international development. At its best, international volunteering brings benefits (and costs) to individual volunteers and the organisations within which they work, at the same time as providing the space for an exchange of technical skills, knowledge, and cross-cultural experience in developing communities. Most significantly, volunteering can raise awareness of, and a lifelong commitment to combating, existing unequal power relations and deep-seated causes of poverty, injustice, and unsustainable development. 
 
 
D.
Volunteer tourism seems to fit well with the growth of life strategies to help others. Such limited strategies, aimed at a humble 'making a difference', can appear positive and attractive in an anti-political climate. The personal element appears positive - it bypasses big government and eschews big business. Yet it also bypasses the democratic imperative of representative government and reduces development to individual acts of charity, most often ones that seek to work around rather than transform the situations of poor, rural societies. Cynicism at the act of volunteering is certainly misplaced. The act of volunteer tourism may involve only simple, commendable charity. However, where volunteer tourism is talked up as sustainable development and the marketing of the gap-year companies merges into development thinking, this is symptomatic of a degradation of the discourse of development. The politics of volunteer tourism represents a retreat from a social understanding of global inequalities and the poverty lived by so many in the developing word. ",4
105,"One very famous place for tourists in London is Madame Tussaud's museum. Here people can see figures of famous people made of wax.
Madame Tussaud was born in France in 1761. Her uncle, a doctor, made wax figures of people. He opened a museum of these figures in Paris. Marie helped him in his work.
In 1789,during the French Revolution, Marie was sent to prison. Here she had to copy the heads of famous people when they were dead, including Queen Marie Antoinette's.
In 1795,Marie married Francois Tussaud and in 1802 she came to London with her wax figures. Here she opened a museum and her figures can still be seen today.",1
106,"Janet - Teacher of London Taxi Drivers
The first thing I do when I get here at 7.30 a.m. is check the accounts. Then I see what new maps and documents need to be produced in order to learn the 'runs' or routes necessary to pass the London taxi-driver test. By midday, about 50 students are in school, working out how to make the journeys. They work out the most direct route, using the correct one-way streets, and right- and left- hand turns. I get involved when there's a difference of opinion - like whether you can do a right turn at a particular junction. When they're close to the test, I'll give them a simple route and no matter what way they say they'll go, I'll tell them they have to use another route because the road is closed. The next student will have to find a third route and again I'll come up with a reason why they can't go that way. It's just to make them think.",3
107,"The site of the Leiper Film Company studios was a huddle of many disparate buildings. The topography of the place was irrational and obscure. It possessed, certainly, a few permanent landmarks such as the Script Department, out for the rest it appeared to be made up of numerous small rooms, identically furnished, which were employed for official and unofficial confabulations and could be distinguished one from another only by a surrealist system of digits and letters of the alphabet, and to locate any particular one of these unaided was a considerable enterprise. More than anything else, perhaps, the studio lacked a focus. A decisive single main entrance might have provided this, but in fact there were three main entrances, severely egalitarian in their amenities and with nothing to choose between them except that one of them gave access to the place where you wanted to arrive and the other two did not; and in none of them was there anywhere where enquiries could be made and some species of orientation established. To the mere stranger it was all vastly confusing.
Mere strangers, however, were few and far between; for obvious reasons, the organisation did not encourage their presence. And it was to be presumed that people who worked there could find their way about all right. And by these employees' united labours, romance and adventure would travel the country. Hand in hand, head against shoulder, Jane and George, Sally and Dick would, for three hours at least, snatch immunity, by the studio's contriving, from domestic contention and public strife, from tedium and malice and routine, and the struggle to keep alive.",5
108,"Fame and Fortune
Imogen Edwards-Jones interviews some of the new British talent, from poet to pop star, heading for the top
A
Nick Grosso, in his early 30s, is the author of three critically acclaimed plays. He is currently adapting his first play, Peaches, into a screenplay. 'It's low budget but we don't know how low,' he explains. 'It certainly won't be over PS30 million, but then it could be 30 quid.'
Although obviously gifted, the most extraordinary thing about Nick is that before he wrote Peaches he had never been to or read a play in his life, 'When I wrote the play, I never even imagined it would get put on,' he says. 'It's set in a car. I probably wouldn't do that now because I know the logistical problems. I knew absolutely nothing then.'
He left school at 16, only to return a year later, After A-levels, he enrolled at the Young People's Theatre, 'I realised I wanted to write for actors. I wanted my writing to be heard rather than read because of the rhythm and rhyme,' he says, 'Suddenly I was surrounded by like-minded people. It was the first time I'd been in an educational environment and actually enjoyed myself. It was very stimulating.'
B
Comedian Simon Pegg, 28, has come a long way in his career since studying drama at Bristol University. He is currently writing a television comedy series, and has just finished a punishing tour around the country with comedy star Steve Coogan,
He's always worked hard, Even as far back as Bristol, he was honing his art in comedy clubs. 'It was very theoretical at university,' remembers Simon, 'It made me realise I didn't want to be a straight actor and that I'd always been more interested in comedy, People think that comedy is the hardest job in the world and it really isn't. If you've got the courage and you've got good material, it's a wonderful thing to make people laugh.'
He has performed with the comic am Funny Business, but his relationship with Steve Coogan that has proved the most fruitful. 'He saw my show and, as I was a huge fan of his, he could probably see me mimicking him,' admits Simon. 'It was comedy clubs. 'It was very theoretical at university.' remembers Simon, 'It made me realise I didn't want to be a straight actor and that I'd always been more interested in comedy. People think that comedy is the hardest job in the world and it really isn't. If you've got the courage and you've got good material, it's a wonderful thing to make people laugh.'
C
Ciaran McMenamin, 24, came to the public's attention when he disco-danced into their living rooms as the lead in the series The Young Person's Guide To Becoming A Rock Star, The critical reaction was extremely positive and his subsequent rise has been meteoric. 'It's been a really good showcase for me,' he says with a smile, 'I'm now in a situation where I can pick and choose what I do, which is what I've always wanted.' It is an unusually comfortable position to be in, especially when you consider that he has only just graduated, But glance at Ciaran's early career, and it's obvious such recognition was always on the cards.
Encouraged by his mother, he went from playing lead roles at school to the Ulster Youth Theatre, where he stayed for four years, 'Basically I was using acting as an excuse not to do homework,' laughs Ciaran. 'But I suddenly decided I wanted to make a go of it because I had a knack for it, and a passion for it.'
Now he is more or less sitting back and waiting for the plaudits to roll in - but ask him what he thinks of the fame game and he suddenly becomes pensive, 'When you're 18, you think you'll love the photos and the interviews but you soon realise it's not what you're acting for. It's not about that, It's about getting respect for doing good work.'
D
Neil Taylor, 25, is the lead singer in the pop band Matrix, which has just signed a three- album deal with Domino Records, Neil and the other half of Matrix, Rick Brown, are already tipped to be huge when their single, Chimera, is released shortly, 'The record company's idea of good sales is very different to mine,' he says, 'They're talking smash hit, but I've no idea, For me, if two people buy it, I'll be happy.'
Unlike so many new pop sensations, Neil has actually worked very hard for his success, He left school at 16 and has been trying to break into the music business ever since, 'It's funny how things happen,' he says, 'I'd been slogging away doing student gigs for eight years and I was starting to get a bit jaded, I was just about to give up when this happened.' By 'this' he means meeting Rick Brown, who already had contacts at Domino, and forming Matrix, It couldn't have happened at a better time, 'There were times when I was thoroughly depressed - and I've been in some atrocious bands, But hopefully it will all have been worth it.'
E
Poet and author Stephen Richards is 27 years old and has won more prizes, awards and academic honours than anyone twice his age, He is already well known on the poetry circuit, where he has been touring and giving several readings a week for the past six years, Now his first novel, Hidden, will be published in March, 'It's a story of obsessive love. It was a very strong idea that I couldn't do as a poem.'
Stephen was a huge fan of creative writing at school, but became disenchanted with education later on, 'I decided not to go to university but it wasn't until I became very bored with stuffing envelopes at a theatre that I decided I should.' After university, he published his first work, a children's book, in 1992, 'I don't think my parents expected me to be a writer - they always thought I'd be a reader because that's all I did as a child.' With his poetry receiving such critical acclaim, his move into novels is indeed brave. 'There's a framework with my poetry and less scope for me to do something hideously wrong,' he explains. 'Because a novel can be any length of words, there are more words that could be bad words. My main ambition is not to get into a pattern where I'm just churning stuff out without worrying about the quality.'
",4
