,Text,Level
72,"The Tartan Museum
The modern, cheese-wedge buildings of Scotland's national museum contrast sharply with its historic Edinburgh location. But would its contents be as striking? Sally Varlow went to visit the museum just before it opened.
You cannot miss it. At first it was only the outside of the new Museum of Scotland that was unmissable, stuck on the corner of Chambers Street in Edinburgh, with its huge, yellow sandstone tower and cheese-wedge buildings, topped by a hulk of a hanging garden. Last winter the building was greeted with a mix of modernist architectural applause ('masterpiece', 'stunning'), cautious approval ('striking') and outright hostility. This winter, now that the inside is almost ready for the opening, the exhibitions themselves look set for a similar fate.
Forget the does-it-tell-a-nation's-story, is-it-chronological debate. The answers are definitely yes; it is a many-splendoured dream-coat of stories, each hung about a precious historic object, and there is an outline timescale that helps visitors get their bearings but does not strait-jacket the displays. And no, it does not let its lovely national treasures - such as Mary Queen of Scots' jewels and the Holyrood chapel silver- get swamped in national pride.
The real issue here. assuming that the collections are properly preserved. is whether people will find the museum interesting enough to come back. Dr David Clarke. the head of exhibitions, insists that a visit should be a pleasurable. visual experience, and that it is designed not for specialists but for those with little prior knowledge. Despite this liberalism. Clarke is a convincing purist when it comes to what is on show. Mock-ups and scenes from the past that rely heavily on imagination are out. For Clarke. they are tantamount to 'giving a complete statement of certainty about what the past was like. which '. he explains, 'would be wrong. The public deserves the truth.' The result is that, at this museum. what you see is what the experts know. But the question for today's visitor is whether the objects' stories can be told vividly enough merely with explanation panels. captions and multi-media interpretation and using barely 30 computers in total around the museum.
Less than three days before the opening, it is still difficult to be sure. Some impressions are clear. though. and it is not just the panoramic views of Edinburgh Castle that take your breath away. Step inside and what immediately hits you is the sequence of spaces. Galleries open one into another. different sizes, different shapes. all with pale walls that are wood- panelled to look like large blocks of stone and inset with deep display cases. Shafts of daylight stream through arrow-slit windows and cascade down from the roof lights. There is room to ponder and enjoy every item on display.
Thanks to the 12-member Junior board. set up three years ago with 9- to l2-year-olds drawn from all over Scotland, the museum also has a Discovery Centre. What the group really wanted was to be able to ride through the displays. Dr Clarke admits. They lost that one, but won a dedicated children's hands-on centre in what should have been the temporary exhibition gallery. As a result. the Twentieth Century gallery, on the top floor. is the only temporary exhibition. Due to change after three years, it is a hotchpotch of objects chosen by Scottish people and other personalities as the items that have had most impact on life in Scotland in the twentieth century. The Prime Minister's suggestion was an electric guitar. Others went for televisions. Thermos flasks and favourite toys. Although the idea is fun. somehow it feels like a lightweight solution that has floated up to the top of the building. not a proper attempt to address serious issues. It may seem less frothy when the computerised bank of personal reasons and recollections goes live next week.
Overall. Dr Clarke seems right when he suggests that 'objects open windows on the past more vividly than anything else'. As for the modernist architecture: it works brilliantly from the inside and the top, but whether it is in the right location is another matter.
",4
73,"Dear Sir, 
I read your advertisement for English courses in the newspaper. I would like to have some more information. How much does a course cost? Also, how long is each course and when does the next course start?
Yours, 
Maria Gonzalez 
 ",1
74,"The Fairview is that rare bird in Africa - a comfortable hotel that hasn't decked itself out in feathers of upmarket gloss and tasteless luxury. It's an indispensable staging post, always full of travellers recuperating from one safari and planning the next. Overnight guests have been known to arrive, take one look at the gardens, the bedrooms and the dining-hall menu, and decide on the spot to stay for a week. There are even apartments set aside specially for those who make up their minds to settle in for a few months. The hotel's leafy acres and scattered buildings are laid out on Nairobi Hill, a world away from the overhead bustle of the city centre. I don't know of any better place to sit and watch the sudden African sunset, sipping draught beer and looking forward to a hearty dinner - braised zebra and two veg, following by jelly trifle.",4
75,"Dear John,
Thank you for helping me with my English. You are a very good teacher. I enjoyed my stay in Cambridge. 
Now I am staying at my brother's flat. He is studying to be a doctor. I will stay with him for two weeks and then go home to Greece.
I like London very much. We travelled to Regents Park by bus yesterday. It was very sunny and we had a good time.
Tonight, I am going to see a film with my brother and some of his friends.
I'll write again from Greece.
Best wishes,
Kostas",1
76,"To the classical world, that of Ancient Greece and Rome, architecture meant much more than the mere construction of buildings. 'Architecture', says the Roman architect Vitruvius, 'consists of Order, and of Arrangement, and of Proportion and Symmetry and Propriety and Distribution.' For several of these terms he gives a Greek equivalent: his definitions probably derived from an earlier Greek authority whose writings are lost to us. Utility and Function are not part of this definition, though in his book Vitruvius does go on to describe the best form and arrangements for different purposes of structure; but here, at the beginning, the aesthetic emphasis, architecture as an art, has priority. The origins of classical architecture are complex. There was obviously a long prehistory of basic construction, of hut habitations simple in form and material, both in Greece and Italy, which did not match up to Vitruvius' artistic requirements. Though these were, by definition, inartistic they nevertheless contributed an essential element of form, which persisted into the later sophisticated architectural concepts. However orate it may appear from the outside, in essence the classical temple is a simple, single-roomed hut.",5
77,"""It's a great feeling to fly through the air and land cleanly, but it can be scary. Sometimes you don't feel well or it's windy and you can't see, but you just get on with it. It's not easy to have a career outside skiing because we train for ten months of the year. You give up a lot of your social life and friends. But it was my choice. There are six men and three women in the British team. We all compete on the same courses at the same competitions and get treated the same - it's a young sport.""",4
78,"Ivan Petrov
Ivan was born on a farm in Russia, but from the age of twelve to eighteen he studied in Poland. His first music teacher couldn't play the piano but taught him and his sister songs from the opera. His mother began to teach him the piano when he was six. At ten, he decided that he wanted to write music too, and he soon started on his first song.
Oleg Gagarin
Oleg was the youngest of five children and when he was four years old his father, who liked playing the piano, taught him some traditional Russian music. When he was six, he started having lessons with a piano teacher who lived in the same city. Oleg soon began to win prizes for his piano playing. At the age of fourteen, he went to a music college in Austria for two years. Later, he returned home to Russia.
Josef Heptmann
Josef's father was German but he taught music in Poland where Josef was born. The family moved to Germany when Josef was two, and a year later he started playing the piano.
He gave his first concert when he was six. At ten, he gave fifty-two concerts in two months during a trip to England! Josef always liked music but he was also interested in physics and languages. He is too busy now but one day he would like to write his own music.",1
79,"The best age to start learning the violin is between three and six,"" says Margaret Porter, a violinist and music teacher. ""It's the time when you are learning about the world."" Margaret, who lives in London, prefers to take pupils at three and four, although she has made lots of exceptions for keen five-year-olds. When she started teaching the violin in 1972, her first class consisted of her children's five-year-old school friends.
Margaret's pupils have group lessons. Each group has about a dozen pupils and each lesson lasts an hour, once a fortnight. In addition, each pupil has one individual lesson a week with her. Parents also have to attend the classes. It is important that the parents take an active interest in the lessons.
From the earliest lessons pupils learn to play by ear. They do not even try to read music until they have been playing for several years, and for a long time there is a big difference between their playing and reading of music. Margaret says that her method is not supposed to produce great violinists, and always suggests that pupils who perform particularly well should leave and study the violin using more traditional methods.",2
80,"""I get up at about 7am, leave the house at 7.30am and get to my first job. My assistant and I spend most of our time maintaining gardens we originally designed and landscaped. We do a few commercial jobs but most of our work is in private gardens. We spend about an hour and a half at each house. At about 11am we get hungry and go to a local cafe for a big breakfast. I often look at my watch and wish it was earlier and that time didn't pass so quickly. In summer I may work until 10pm; in winter until 4.30pm.
The business office is at home, so when I get back I listen to any messages and respond to any calls. If someone wants their garden landscaped, I'll usually arrange a consultation with them in the evening - at about 7pm or 8pm. We specialise in using old materials, such as old bricks and unusual plants, to make gardens look as if they were built a long time ago. But sometimes people have a set idea of what they want, and it can be pretty horrible. Still, its very satisfying when we do a complete landscape from start to finish and then see all the blooms come out.
It's hard to relax in the evenings because I can always hear the business line when it rings. I never have any trouble sleeping because the work I do is so physical that I'm always exhausted at the end of the day. I wouldn't say I'm very strong, but I'm fit. Physically, it's a very tough job, but it does let your imagination run wild.""",4
81,"Therapist: 'I believe you must have an interest in and respect for what you do in life. I like to take risks and I get bored quickly, which keeps me motivated. Doing things you don't want to do wears you out. I used to be a member of various committees and resented the demands they made on my time. You only have a certain amount of energy, so direct it into the things that are most important to you.' ",3
82,"A Long Day
Ann walked into the bedroom. She woke up the baby, and saw she needed a bottle of milk. After she gave her a bottle, she went to the bathroom and took a shower. She put on some warm clothes because it was cold and rainy outside. Then she started her car, and drove to her job at the library. She stopped her work at 5 o'clock, and said goodbye to everybody. She drove to the bookstore, and then went home.  Ann's husband said the baby was sick, so she gave her some medicine. Then she cooked dinner for everybody, and went to bed very early at 9 o'clock. It was a long day! She was glad tomorrow was a holiday.
",0
83,"Farm Animals
We don't think about cows very much, but they are actually very interesting! Cows are very large animals, but you shouldn't be afraid of them. They are nice animals! Baby cows can be really cute, and they are friendly and like to play a lot. Cows eat a lot of grass, but they eat some other plants too. They are an important part of what people eat too. Cows give us milk, and without milk you could not eat cheese, yogurt, or ice cream! Cows also like to be around other cows, they do not like to be alone. They are just like us!",0
84,"As the day drew to a close, I started to think about the night ahead, and I shuddered with fear. The canoe was too wet to sleep in, there was nowhere to stop, and we hadn't seen any villages or huts since early morning. In the dim moonlight, and with the aid of our torch we could just make out the line of the cliffs; the torch batteries were failing, so we put in new ones, but they didn't work. Obviously we weren't going to be able to spot a camping place. A couple of miles later, Lesley called out that she had seen a distant flickering light and our hopes soared: the light turned out to be moonlight glinting on waves, soon we could hear the roaring noise of fast-rushing water, though we couldn't see what was happening. Time stood still, and we moved on.",5
85,"Magazine editor: 'I have so much work to do but I enjoy it all - I love being at work, it isn't a chore. If you enjoy something, it doesn't make you feel low even though you may be feeling tired. I need a fair bit of sleep so when I do get it I feel really good. When I'm 
running at six hours' sleep a night, I feel a bit wet. I know exercise gives me energy, but it's finding the energy to do it! I do a yoga class once a week before work and I try to do a workout tape at home. But if I've done exercise, my spirits rise amazingly. I get very low patches in the office between 3 and 5 in the afternoon and think it's probably good to eat something then.' ",3
86,"Since it opened, the Eden Project in the south-west of England has become one of the UK's most popular tourist attractions. At first sight, the huge 'biospheres' on this former industrial site look like a scene from a science-fiction movie. ",2
87,"An eye for detail
Artist Susan Shepherd is best known for her flower paintings, and the large garden that surrounds her house is the source of many of her subjects. It is full of her favourite flowers, most especially varieties of tulips and poppies. Some of the plants are unruly and seed themselves all over the garden. There is a harmony of colour, shape and structure in the two long flower borders that line the paved path which crosses the garden from east to west. Much of this is due to the previous owners who were keen gardeners, and who left plants that appealed to Susan. She also inherited the gardener, Danny. 'In fact, it was really his garden,' she says. 'We got on very well. At first he would say, ""Oh, it's not worth it"" to some of the things I wanted to put in, but when I said I wanted to paint them, he recognised what I had in mind.'
Susan prefers to focus on detailed studies of individual plants rather than on the garden as a whole, though she will occasionally paint a group of plants where they are. More usually, she picks them and then takes them up to her studio. 'I don't set the whole thing up at once,' she says. 'I take one flower out and paint it, which might take a few days, and then I bring in another one and build up the painting that way. Sometimes it takes a couple of years to finish.'
Her busiest time of year is spring and early summer, when the tulips are out, followed by the poppies. 'They all come out together, and you're so busy,' she says. But the gradual decaying process is also part of the fascination for her. With tulips, for example, 'you bring them in and put them in water, then leave them for perhaps a day and they each form themselves into different shapes. They open out and are fantastic. When you first put them in a vase, you think they are boring, but they change all the time with twists and turns.'
Susan has always been interested in plants: 'I did botany at school and used to collect wild flowers from all around the countryside,' she says. 'I wasn't particularly interested in gardening then; in fact, I didn't like garden flowers, I thought they looked like the ones made of silk or plastic that were sold in some florists' shops - to me, the only real ones were wild. I was intrigued by the way they managed to flower in really awkward places, like cracks in rocks or on cliff tops.' Nowadays, the garden owes much to plants that originated in far-off lands, though they seem as much at home in her garden as they did in China or the Himalayas. She has a come-what-may attitude to the garden, rather like an affectionate aunt who is quite happy for children to run about undisciplined as long as they don't do any serious damage.
With two forthcoming exhibitions to prepare for, and a ready supply of subject material at her back door, finding time to work in the garden has been difficult recently. She now employs an extra gardener but, despite the need to paint, she knows that, to maintain her connection with her subject matter, 'you have to get your hands dirty'.",3
88,"Four academic writers discuss the topic of international voluntary work. 
 
A.
It is hard to argue that the actual contribution to development amounts to a great deal directly. Whilst volunteer tourists can get involved in building homes or schools, they have usually paid a significant fee for the opportunity to be involved in this work: money that, if donated to a local community directly, could potentially pay for a greater amount of labour than the individual volunteer could ever hope to provide. This is especially so in the case of gap years, in which the level of technical skill or professional experience required of volunteers is negligible. Hence, it is unsurprising that many academic studies allude to the moral issue of whether gap year volunteering is principally motivated by altruism - a desire to benefit the society visited - or whether young people aim to generate 'cultural capital' which benefits them in their careers. However, the projects may play a role in developing people who will, in the course of their careers and lives, act ethically in favour of those less well-off. ",4
89,"Grass is probably the most successful living plant in the world. There are over 9,000 different types of grasses and they are found in every region on the earth. They are the single flowering plants that can exist in the freezing environment of the Arctic and the Antarctic. 
Grasslands support a wide range of animal life, from tiny insects and birds to huge animals like cows and lions. All of them depend on grass in one way or another. 
Grass recovers very quickly after it is cut or damaged. Unlike other plants, the new leaves grow from below the soil, not from the top of the plant. That is why large families of animals are able to live together in one area. As soon as they have eaten all the grass there, a fresh meal is always available because the plants start to grow again. ",2
90,"While publishers and the press fairly obviously have a common interest in the nature of book review pages, one also needs to remember that their requirements substantially differ: a newspaper or magazine needs to provide its readers with appropriately entertaining material; a publishing house wants to see books, preferably its own, reviewed, preferably favourably.
Without any question, book reviewing is 'better' -- more diverse, less elitist -- than 40 years ago, when I began reading review pages. That said, there is still a long-grumbled-about tendency to neglect the book medium read by a majority -- namely paperbacks. The weekly roundups aren't really adequate even if conscientiously done. And even original paperbacks only rarely receive serious coverage.
But publishers shouldn't complain too much. Like readers and writers, they need reviews, which after all are an economical way of getting a book and an author known. There is no question that a lively account of a new book by a trusted name can generate sales even more if there are several of them. Fame is what puts a book into the hands of readers.",4
91,"The Rocky Mountains run almost the length of North America.
They start in the North-west, but lie only a few hundred miles from the 
centre in more southern areas. Although the Rockies are smaller than the Alps, they are no less wonderful. 
There are many roads across the Rockies, but the best way to see them is to travel by train. You start from Vancouver, the most attractive of Canada's big cities. Standing with its feet in the water and its head in the mountains, this city allows its residents to ski on slopes just 15 minutes by car from the city centre. 
Thirty passenger trains a day used to set off from Vancouver on the cross- continent railway. Now there are just three a week, but the ride is still a great adventure. You sleep on board, which is fun, but travel through some of the best scenery at night. 
",2
92,"Four people talk about their jobs.
Lisa - Exhibition Programmes Organiser, Science Museum
I'm responsible for putting temporary exhibitions together. This includes planning and designing the exhibition and promoting it. I have to read up about the subject of the exhibition beforehand and then talk to important people in the area so that I can establish the main themes and aims of the exhibition, and plan what objects and pictures should be displayed. I have to make sure the public can understand the thinking behind the exhibition, which means planning interactive displays, workshops and theatre. I also have to bring in engineers and electricians to make sure the final display is not dangerous to visitors. Before the exhibition opens, I help design and write the brochures and leaflets that we'll use to tell people about it.",3
93,"I am going to describe a situation, and then ask a crucial question about it. I hope it doesn't strike you as unduly gnomic. But if it does, that's modern art for you.
Here's the situation. An artist chooses a piece of text in an art book. The text considers the diversity of pictures. 'What are they all about?' it asks dumbly, before deciding, even more dumbly: 'There is no end, in fact, to the number of different kinds of pictures.' Okay, this is kiddy-language, and so far all it has betrayed is kiddy-thinking. But stick with me, all you adults out there. The situation is about to complicate itself.
Having settled on his text, the man then asks someone else to make a canvas for him, to stretch it and prime it, and then to take it along to a sign painter. He asks the sign painter to write the chosen text on the canvas. And he gives the sign painter specific instructions not to attempt anything flashy or charming with the lettering. The sign painter does all this. On a white canvas, in simple black letters, he writes the chosen text. So my crucial question is this: is the finished product a painting?",5
94,Get the leading edge - motivate yourself to take full control at work.,4
95,"Bill Prince-Smith was a farmer and a teacher and a dentist before he became a writer of children's books at the age of 60. Now, thirteen years later, he has written more than 80 books. Every day, he goes into his office and writes. In the evening, he gives the work to his wife to read. 'She tells me when she doesn't like something,' says Bill. 'My ten grandchildren don't live near here but they also read my stories and say if they are good or bad.' And so Bill has learned what young children want to read.
Bill writes about the life in his village and on the farms near it. His fifth book is his favourite: The Sheepdog is about a farmer and the dog that helps him.
'I have always liked animals,' says Bill, 'and dogs are so clever, they learn very quickly.'
Last year, the book was made into a film with real animals and actors. The film-makers used the latest computer technology to make people think that the animals are speaking. Bill was very pleased with the film. 'Sometimes film- makers change books, but they didn't change mine and I love the film.'",1
96,"As you enter a supermarket, giant colour photographs of succulent roasts, fancy cakes and cheeses hit you - irresistible if you've had nothing to eat before setting out on your shopping trip. In the United States, 'video trolleys' are being tried out in a number of supermarkets. Each trolley has a screen which advertises products as you shop. Sensors at the end of shelves trigger relevant advertising - so the shopper passing the cook-chill cabinets, say, may receive an ad on the screen for ready-made moussaka. Such trolleys are aimed unashamedly at the impulse shopper, and the makers claim they increase sales by around 30 per cent.",4
